Pathway,GeneCount,Genes
ER-Phagosome pathway,93,"B2M, BTK, CALR, CD14, CD36, CHUK, FGA, FGB, FGG, HLA-A, HLA-B, HLA-C, HLA-E, HLA-F, HLA-G, HLA-H, HMGB1, IKBKB, IKBKG, LY96, MYD88, PDIA3, PSMA1, PSMA2, PSMA3, PSMA4, PSMA5, PSMA6, PSMA7, PSMA8, PSMB1, PSMB10, PSMB11, PSMB2, PSMB3, PSMB4, PSMB5, PSMB6, PSMB7, PSMB8, PSMB9, PSMC1, PSMC2, PSMC3, PSMC4, PSMC5, PSMC6, PSMD1, PSMD10, PSMD11, PSMD12, PSMD13, PSMD14, PSMD2, PSMD3, PSMD4, PSMD5, PSMD6, PSMD7, PSMD8, PSMD9, PSME1, PSME2, PSME3, PSME4, PSMF1, RPS27A, S100A1, S100A8, S100A9, SEC22B, SEC61A1, SEC61A2, SEC61B, SEC61G, SEM1, SNAP23, STX4, TAP1, TAP2, TAPBP, TIRAP, TLR1, TLR2, TLR4, TLR6, UBA52, UBB, UBC, VAMP3, VAMP8, mip, porB"
Induction of autophagy and toll-like receptor signaling pathways by graphene oxide,11,"BECN1, IFNB1, IFNG, IRF3, MAP1LC3A, MYD88, NFKB1, TLR4, TLR9, TNF, TRAF6"
Toll-like receptor signaling pathway,106,"AKT1, AKT2, AKT3, CASP8, CCL3, CCL4, CCL4L2, CCL5, CD14, CD40, CD80, CD86, CHUK, CXCL10, CXCL11, CXCL8, CXCL9, FADD, FOS, IFNA1, IFNA10, IFNA13, IFNA14, IFNA16, IFNA17, IFNA2, IFNA21, IFNA4, IFNA5, IFNA6, IFNA7, IFNA8, IFNAR1, IFNAR2, IFNB1, IKBKB, IKBKE, IKBKG, IL12A, IL12B, IL1B, IL6, IL8, IRAK1, IRAK4, IRF3, IRF5, IRF7, JUN, LBP, LY96, MAP2K1, MAP2K2, MAP2K3, MAP2K4, MAP2K6, MAP2K7, MAP3K7, MAP3K8, MAPK1, MAPK10, MAPK11, MAPK12, MAPK13, MAPK14, MAPK3, MAPK8, MAPK9, MYD88, NFKB1, NFKBIA, NFKBIB, PIK3CA, PIK3CB, PIK3CD, PIK3CG, PIK3R1, PIK3R2, PIK3R3, PIK3R5, RAC1, RELA, RIPK1, SPP1, STAT1, TAB1, TAB2, TAB3, TBK1, TICAM1, TICAM2, TIRAP, TLR1, TLR2, TLR3, TLR4, TLR5, TLR6, TLR7, TLR8, TLR9, TMED7, TNF, TOLLIP, TRAF3, TRAF6"
Toll-like receptor signaling related to MyD88,32,"CHUK, IKBKB, IKBKE, IKBKG, IRAK1, IRAK4, IRF3, IRF7, MAPK1, MYD88, NFKB1, NFKB2, REL, RELA, RELB, TBK1, TICAM1, TICAM2, TIRAP, TLR1, TLR2, TLR3, TLR4, TLR5, TLR6, TLR7, TLR8, TLR9, TMED7, TOLLIP, TRAF3, TRAF6"
Cytokine-cytokine receptor interaction,35,"BMP3, BMP4, BMP5, BMP6, BMP8A, CCR4, CXCR4, GDF2, GDF5, IFNA1, IFNA10, IFNA13, IFNA14, IFNA16, IFNA17, IFNA21, IFNA4, IFNA5, IFNA6, IFNA7, IFNA8, IFNAR1, IL18R1, IL18RAP, IL1R1, IL1RAP, IL1RL1, IL1RL2, IL6, NGF, TGFB1, TGFB2, TGFB3, TGFBR1, TPO"
NOD-like receptor signaling pathway,26,"BRCC3, CASP1, CASP12, CASP4, HSP90AA1, HSP90AB1, IFNA1, IFNA10, IFNA13, IFNA14, IFNA16, IFNA17, IFNA21, IFNA4, IFNA5, IFNA6, IFNA7, IFNA8, IFNAR1, IL6, IRF7, MYD88, NLRP1, NOD2, PYCARD, STING1"
